{
  "name": "ARMSX2 iOS",
  "identifier": "com.j1coding.armsx2.ios",
  "sourceURL": "https://ios.armsx2.net/apps.json",
  "apps": [
    {
      "name": "ARMSX2 iOS",
      "bundleIdentifier": "com.armsx2.ios",
      "developerName": "ARMSX2",
      "subtitle": "Modern PlayStation 2 emulation for iOS.",
      "localizedDescription": "ARMSX2 brings PlayStation 2 emulation to iOS devices. Based on the open-source PCSX2 project, this ARM64-focused iOS build helps you revisit and preserve your own legally obtained PS2 game library on modern mobile hardware.\n\nFeatures:\n- Customizable touchscreen controls and external controller support\n- Graphics settings, performance options, save states, and memory card support\n- Local-network support for compatible online titles\n\nImportant iOS requirements:\nA JIT-capable setup is required for playable performance. Compatibility varies by device, iOS version, game, and sideloading environment, including LiveContainer, SideStore, or Feather.\n\nDisclaimer:\nARMSX2 does not include games or BIOS files. Users must provide their own legally obtained BIOS and game backups, such as ISO files. ARMSX2 is not affiliated with Sony Interactive Entertainment or PlayStation.\n\nCredits:\nThe upstream ARMSX2 project was founded by jpolo1224 and MoonPower, with work from contributors including Zeruth and Dib1998.",
      "iconURL": "https://ios.armsx2.net/assets/icon.png",
      "screenshotURLs": [
        "https://ios.armsx2.net/assets/screenshots/01-library.png",
        "https://ios.armsx2.net/assets/screenshots/02-settings.png",
        "https://ios.armsx2.net/assets/screenshots/03-gameplay.png"
      ],
      "tintColor": "#2F6FAD",
      "versions": [
        {
          "version": "2.2.2",
          "date": "2026-06-14",
          "localizedDescription": "Updated to ARMSX2 iOS 2.2.2.\n\nFixed Sonic Unleashed iOS Metal rendering by allowing the game’s required OI_SonicUnleashed GameDB beforeDraw callback through the iOS Metal callback safety filter.\n\nBrought over @isztldav ARM64 EE timing fixes: flushes cpuRegs.cycle before inline COP2/VU0 macro ops so VU timing is current,\napplies the COP0 Config.DIE EE cycle multiplier like x86 PCSX2. Crash Twinsanity is now fixed thanks to these changes!\n\nAdded Apple Airplay support, ARMSX2 iOS can now be played on a TV!\n\nHardcore RetroAchievements is now in the review stage for iOS! I will update when the RA team has approved us, it will take some time. For the time being the hardcore toggle has been hidden. Softcore RetroAchievements works as intended.\n\nFrom @j1coding PR:",
          "downloadURL": "https://ios.armsx2.net/ipas/ARMSX2-iOS-2.2.2.ipa",
          "size": 19085753,
          "minOSVersion": "17.0"
        }
      ],
      "permissions": [
        {
          "type": "network",
          "usageDescription": "ARMSX2 uses local network access for PS2 online play through DEV9 sockets."
        }
      ]
    }
  ]
}
